{
  "configuration_id": "demo_shop/configurations",
  "current": {
    "configuration_id": "demo_shop/configurations/1",
    "digest": "sha256:d9a0d3a5b2e7d0d153dc5c7a28dff036fbe9c8a78a8c2c9930f90c163b553132"
  },
  "project_ref": "demo_shop",
  "schema_version": "control-plane/configuration-index/v1"
}
